{
  "comparison_id": "matrix-local-check-dashboard-supply-chain-r01",
  "preferred_output": "B",
  "confidence": 0.4,
  "scores": {
    "A": {
      "hierarchy_clarity": 4,
      "visual_specificity": 4,
      "spacing_and_layout_discipline": 5,
      "component_consistency": 4,
      "responsiveness_and_adaptability": 5,
      "implementation_readiness": 5,
      "style_fidelity": 3
    },
    "B": {
      "hierarchy_clarity": 4,
      "visual_specificity": 5,
      "spacing_and_layout_discipline": 5,
      "component_consistency": 5,
      "responsiveness_and_adaptability": 5,
      "implementation_readiness": 5,
      "style_fidelity": 5
    }
  },
  "notes": {
    "strengths_of_A": [
      "Clearer visual direction and stronger surface treatment.",
      "Layout uses more deliberate grid and spacing signals.",
      "Responsive intent is visible through media-query and sizing choices."
    ],
    "strengths_of_B": [
      "Clearer visual direction and stronger surface treatment.",
      "Layout uses more deliberate grid and spacing signals.",
      "Responsive intent is visible through media-query and sizing choices."
    ],
    "deciding_factors": [
      "Heuristic judge compared hierarchy, specificity, spacing, responsiveness, and implementation readiness.",
      "Mean score delta: 0.5714 in favor of GRIT."
    ],
    "risks_or_ambiguities": [
      "This result comes from a local heuristic judge, not a model-as-judge review.",
      "Use a blind model judge for stronger benchmark credibility."
    ]
  }
}
